productId,itemId,vendoritems,产品名称,产品缩略图,销售价,折扣,市场价,每毫升单价,评论数,品牌,品牌链接,容量重量,适合肌肤类型,流通期限,使用方法,化妆品制造企业,化妆品销售企业,制造国家,成分,功能性化妆品,使用注意事项,品质保证基准,售后服务电话,流通公司名称,流通公司营业执照号码,流通公司通信销售申告号码,流通公司地址,流通公司邮箱,流通公司联系人,流通公司联系电话,流通公司&法人姓名,当前网址,当前时间
1414809213,2451494211,70445138100,라운드랩 독도 토너,https://thumbnail6.coupangcdn.com/thumbnails/remote/230x230ex/image/retail/images/4059172963886-d434b937-b2f4-4ffb-b044-8c6f510dfa92.jpg,"15,510",48%,"30,000원",(10ml당 310원),"9,411개 상품평",라운드랩,,500ml,모든 피부용,추후 업데이트 예정,"세안 후 적당량을 덜어 화장솜에 충분히 적신 뒤, 피부결을 따라 부드럽게 닦아내어 피부를 정돈시켜 줍니다.",코스맥스(주),서린컴퍼니㈜,"['{""rollbackInterstellar"":false,""productId"":1414809213,""itemId"":2451494211,""vendorItemId"":70445138100,""vendorItemCertifications"":[],""returnPolicyVo"":{""vendorItemReturnPolicyLayoutType"":""RETAIL"",""vendorItemReturnNotice"":{""returnCharge"":""5,000원<br/>- 단, 고객 변심의 경우에만 발생<br/>- 부분반품 시, 남은금액이 무료배송 조건을 유지하면 일부 반품비용이 부과""},""vendorItemDeliveryNotice"":{""supportSameDayFresh"":true,""rocketInstall"":false,""rocketFresh"":false,""deliveryMethod"":""순차배송"",""deliveryCompany"":"""",""deliveryCharge"":""무료배송<br/>- 로켓배송 상품 중 19,800원 이상 구매 시 무료배송<br/>- 도서산간 지역 추가비용 없음"",""batchShipment"":""가능"",""shippingPeriod"":null},""sellerDetailInfo"":{""vendorName"":null,""threePM"":false,""threePC"":false,""sellerWithRepPersonName"":null,""retail"":true,""repPhoneNum"":null,""repPersonName"":null,""repEmail"":null,""repAddress2"":null,""repAddress1"":null,""repAddress"":null,""ecommReportNum"":null,""bizNum"":null}},""productSellingPoints"":[],""exemption"":null,""essentials"":[{""title"":""용량(중량)"",""description"":""500ml""},{""title"":""제품 주요 사양"",""description"":""모든 피부용""},{""title"":""사용기한 또는 개봉 후 사용기간"",""description"":""추후 업데이트 예정""},{""title"":""사용방법"",""description"":""세안 후 적당량을 덜어 화장솜에 충분히 적신 뒤, 피부결을 따라 부드럽게 닦아내어 피부를 정돈시켜 줍니다.""},{""title"":""화장품제조업자 및 화장품책임판매업자"",""description"":""코스맥스(주)/서린컴퍼니㈜""},{""title"":""']","정제수, 부틸렌글라이콜, 글리세린, 펜틸렌글라이콜, 프로판다이올, 아이리쉬모스추출물, 사탕수수추출물, 해수, 1,2-헥산다이올, 프로테아제, 베타인, 판테놀, 에틸헥실글리세린, 알란토인, 잔탄검, 다이소듐이디티에이",해당없음,"1)화장품 사용 시 또는 사용 후 직사광선에 의하여 사용부위가 붉은 반점, 부어오름 또는 가려움증 등의 이상 증상이나 부작용이 있는 경우 전문의 등과 상담 할 것 2)상처가 있는 부위 등에는 사용을 자제할 것 15)보관 및 취급 시의 주의사항 가)어린이의 손이 닿지 않는 곳에 보관할 것 나)직사광선을 피해서 보관할 것",제품 이상 시 공정거래위원회 고시 소비자분쟁해결기준에 의거 보상합니다.,쿠팡고객센터 1577-7011,,,,,,,,,https://www.coupang.com/vp/products/1414809213?itemId=2451494211&vendorItemId=70445138100&sourceType=CATEGORY&categoryId=486148,2021-12-29 16:50:33
5226531747,5847430073,79903856189,토니모리 원더 세라마이드 모찌 토너,https://thumbnail7.coupangcdn.com/thumbnails/remote/230x230ex/image/retail/images/10813734813576387-29a1d210-1c55-4736-84cf-9332046d712f.jpg,"11,800",%,원,(10ml당 236원),"15,911개 상품평",토니모리,,상품 상세페이지 참조,상품 상세페이지 참조,상품 상세페이지 참조,상품 상세페이지 참조,상품 상세페이지 참조,상품 상세페이지 참조,"['{""rollbackInterstellar"":false,""productId"":5226531747,""itemId"":5847430073,""vendorItemId"":79903856189,""vendorItemCertifications"":[],""returnPolicyVo"":{""vendorItemReturnPolicyLayoutType"":""THIRD_PARTY"",""vendorItemReturnNotice"":{""returnCharge"":""6,000원<br/>- 단, 고객 변심의 경우에만 발생<br/>- 도서산간 및 일부 지역 추가비용 발생<br/>""},""vendorItemDeliveryNotice"":{""supportSameDayFresh"":true,""rocketInstall"":false,""rocketFresh"":false,""deliveryMethod"":""순차배송"",""deliveryCompany"":""한진택배"",""deliveryCharge"":""무료배송<br/>· 도서산간 추가 배송비<br/>- 제주 지역: 3,000원<br/>- 도서산간 지역: 4,000원"",""batchShipment"":""가능"",""shippingPeriod"":null},""sellerDetailInfo"":{""vendorName"":""리앤햇"",""threePM"":true,""threePC"":false,""sellerWithRepPersonName"":""리앤햇 / 이찬영"",""retail"":false,""repPhoneNum"":""010-8000-8929"",""repPersonName"":""이찬영"",""repEmail"":""lee_and_hat@naver.com"",""repAddress2"":""101 1507"",""repAddress1"":""서울특별시 성북구 화랑로 235"",""repAddress"":""서울특별시 성북구 화랑로 235 101 1507"",""ecommReportNum"":""제2020서울성북0773"",""bizNum"":""211-17-82288""}},""productSellingPoints"":[],""exemption"":null,""essentials"":[{""title"":""용량(중량)"",""description"":""상품 상세페이지 참조""},{""title"":""제품 주요 사양"",""description"":""상품 상세페이지 참조""},{""title"":""사용기한 또는 개봉 후 사용기간"",""description"":""상품 상세페이지 참조""},{""title"":""사용방법"",""description"":""상품 상세페이지 참조""},{""title"":""화장품제조업자 및 화장품책임판매업자"",""description"":""상품 상세페이지 참조""},{""title"":""']",상품 상세페이지 참조,상품 상세페이지 참조,상품 상세페이지 참조,상품 상세페이지 참조,상품 상세페이지 참조,리앤햇,211-17-82288,제2020서울성북0773,서울특별시 성북구 화랑로 235 101 1507,lee_and_hat@naver.com,이찬영,010-8000-8929,리앤햇 / 이찬영,https://www.coupang.com/vp/products/5226531747?itemId=5847430073&vendorItemId=79903856189&sourceType=CATEGORY&categoryId=486148,2021-12-29 16:50:33
4880173278,6353129904,73648417455,닥터지 레드 블레미쉬 클리어 수딩 토너,https://thumbnail7.coupangcdn.com/thumbnails/remote/230x230ex/image/retail/images/1368445133157854-58b508eb-2a63-45a6-a103-29cef68dec53.jpg,"17,600",48%,"29,000원",쿠팡판매가,"3,595개 상품평",닥터지,,300ml,모든 피부용,추후 업데이트 예정		,컨텐츠참조,주)한국콜마,(주)고운세상코스메틱,"['{""rollbackInterstellar"":false,""productId"":4880173278,""itemId"":6353129904,""vendorItemId"":73648417455,""vendorItemCertifications"":[],""returnPolicyVo"":{""vendorItemReturnPolicyLayoutType"":""RETAIL"",""vendorItemReturnNotice"":{""returnCharge"":""5,000원<br/>- 단, 고객 변심의 경우에만 발생<br/>- 부분반품 시, 남은금액이 무료배송 조건을 유지하면 일부 반품비용이 부과""},""vendorItemDeliveryNotice"":{""supportSameDayFresh"":true,""rocketInstall"":false,""rocketFresh"":false,""deliveryMethod"":""순차배송"",""deliveryCompany"":"""",""deliveryCharge"":""무료배송<br/>- 로켓배송 상품 중 19,800원 이상 구매 시 무료배송<br/>- 도서산간 지역 추가비용 없음"",""batchShipment"":""가능"",""shippingPeriod"":null},""sellerDetailInfo"":{""vendorName"":null,""threePM"":false,""threePC"":false,""sellerWithRepPersonName"":null,""retail"":true,""repPhoneNum"":null,""repPersonName"":null,""repEmail"":null,""repAddress2"":null,""repAddress1"":null,""repAddress"":null,""ecommReportNum"":null,""bizNum"":null}},""productSellingPoints"":[],""exemption"":null,""essentials"":[{""title"":""용량(중량)"",""description"":""300ml""},{""title"":""제품 주요 사양"",""description"":""모든 피부용""},{""title"":""사용기한 또는 개봉 후 사용기간"",""description"":""추후 업데이트 예정\\t\\t""},{""title"":""사용방법"",""description"":""컨텐츠참조""},{""title"":""화장품제조업자 및 화장품책임판매업자"",""description"":""주)한국콜마 / (주)고운세상코스메틱""},{""title"":""']","정제수, 다이프로필렌글라이콜, 프로판다이올, 글리세린, 펜틸렌글라이콜, 나이아신아마이드, 부틸렌글라이콜, 쇠비름추출물, 병풀추출물, 무화과추출물, 흰버드나무껍질추출물, 사탕수수추출물, 사과추출물, 케이프알로에잎추출물, 하이드로제네이티드레시틴, 판테놀, 라피노오스, 아크릴레이트/C10-30알킬아크릴레이트크로스폴리머, 트로메타민, 다이소듐이디티에이, 베타인, 베타-글루칸, 마데카소사이드, 세라마이드엔피, 마데카식애씨드, 아시아티코사이드, 아시아틱애씨드, 에틸헥실글리세린, 1,2-헥산다이올, 카프릴릴글라이콜",해당없음,"1) 화장품 사용 시 또는 사용 후 직사광선에 의하여 사용부위가 붉은 반점, 부어오름 또는 가려움증 등의 이상 증상이나 부작용이 있는 경우 전문의 등과 상담할 것 2) 상처가 있는 부위 등에는 사용을 자제할 것 3) 보관및 취급 시의 주의사항 가) 어린이의 손이 닿지 않는 곳에 보관할 것 나) 직사광선을 피해서 보관할 것 4) 눈 주위를 피하여 사용할 것 기타. 붙이는 반창고나 습포에 자극이 심한 분은 주의하십시오",제품 이상 시 공정거래위원회 고시 소비자분쟁해결기준에 의거 보상합니다.		,쿠팡고객센터 1577-7011		,,,,,,,,,https://www.coupang.com/vp/products/4880173278?itemId=6353129904&vendorItemId=73648417455&sourceType=CATEGORY&categoryId=486148,2021-12-29 16:50:34
1414809213,2779751047,5484609359,라운드랩 1025 독도 토너,https://thumbnail9.coupangcdn.com/thumbnails/remote/230x230ex/image/retail/images/3862026491249-52ae6d84-fe01-4add-bd20-0caee77c9bfe.jpg,"8,300",44%,"15,000원",(10ml당 415원),"9,411개 상품평",라운드랩,,200ml,모든 피부용,본 상품은 해당 물류센터 직발송 상품인 관계로 제조연월일 및 유통기한 정보가 매번 변경되어 정확한 정보제공이 어렵습니다.,"세안 후 적당량을 덜어 화장솜에 충분히 적신 뒤, 피부결을 따라 부드럽게 닦아내어 피부를 정돈시켜 줍니다.",코스맥스(주),서린컴퍼니(주),"['{""rollbackInterstellar"":false,""productId"":1414809213,""itemId"":2779751047,""vendorItemId"":5484609359,""vendorItemCertifications"":[],""returnPolicyVo"":{""vendorItemReturnPolicyLayoutType"":""RETAIL"",""vendorItemReturnNotice"":{""returnCharge"":""5,000원<br/>- 단, 고객 변심의 경우에만 발생<br/>- 부분반품 시, 남은금액이 무료배송 조건을 유지하면 일부 반품비용이 부과""},""vendorItemDeliveryNotice"":{""supportSameDayFresh"":true,""rocketInstall"":false,""rocketFresh"":false,""deliveryMethod"":""순차배송"",""deliveryCompany"":"""",""deliveryCharge"":""무료배송<br/>- 로켓배송 상품 중 19,800원 이상 구매 시 무료배송<br/>- 도서산간 지역 추가비용 없음"",""batchShipment"":""가능"",""shippingPeriod"":null},""sellerDetailInfo"":{""vendorName"":null,""threePM"":false,""threePC"":false,""sellerWithRepPersonName"":null,""retail"":true,""repPhoneNum"":null,""repPersonName"":null,""repEmail"":null,""repAddress2"":null,""repAddress1"":null,""repAddress"":null,""ecommReportNum"":null,""bizNum"":null}},""productSellingPoints"":[],""exemption"":null,""essentials"":[{""title"":""용량(중량)"",""description"":""200ml""},{""title"":""제품 주요 사양"",""description"":""모든 피부용""},{""title"":""사용기한 또는 개봉 후 사용기간"",""description"":""본 상품은 해당 물류센터 직발송 상품인 관계로 제조연월일 및 유통기한 정보가 매번 변경되어 정확한 정보제공이 어렵습니다.""},{""title"":""사용방법"",""description"":""세안 후 적당량을 덜어 화장솜에 충분히 적신 뒤, 피부결을 따라 부드럽게 닦아내어 피부를 정돈시켜 줍니다.""},{""title"":""화장품제조업자 및 화장품책임판매업자"",""description"":""코스맥스(주) / 서린컴퍼니(주)""},{""title"":""']","정제수, 부틸렌글라이콜, 글리세린, 펜틸렌글라이콜, 프로판다이올, 아이리쉬모스추출물, 사탕수수추출물, 해수, 1,2-헥산다이올, 프로테아제, 베타인, 판테놀, 에틸헥실글리세린, 알란토인, 잔탄검, 다이소듐이디티에이",해당없음,"1)화장품 사용 시 또는 사용 후 직사광선에 의하여 사용부위가 붉은 반점, 부어오름 또는 가려움증 등의 이상 증상이나 부작용이 있는 경우 전문의 등과 상담 할 것 2)상처가 있는 부위 등에는 사용을 자제할 것 14)보관 및 취급 시의 주의사항 가)어린이의 손이 닿지 않는 곳에 보관할 것 나)직사광선을 피해서 보관할 것",제품 이상 시 공정거래위원회 고시 소비자분쟁해결기준에 의거 보상합니다.,쿠팡고객센터 1577-7011,,,,,,,,,https://www.coupang.com/vp/products/1414809213?itemId=2779751047&vendorItemId=5484609359&sourceType=CATEGORY&categoryId=486148,2021-12-29 16:50:34
4880518173,6353762537,5305368894,시드물 오리지널 웰빙 녹차 스킨,https://thumbnail6.coupangcdn.com/thumbnails/remote/230x230ex/image/retail/images/9609843793143688-1563321e-e384-41fa-95ee-cf0ce36cf7fb.jpg,"4,300",%,원,(10ml당 287원),"4,006개 상품평",,,150 ml,모든 피부용,본 상품은 해당 물류센터 직발송 상품인 관계로 제조연월일 및 유통기한 정보가 매번 변경되어 정확한 정보제공이 어렵습니다.				,컨텐츠 참조,제품내별도표기,(주)시드물,"['{""rollbackInterstellar"":false,""productId"":4880518173,""itemId"":6353762537,""vendorItemId"":5305368894,""vendorItemCertifications"":[],""returnPolicyVo"":{""vendorItemReturnPolicyLayoutType"":""RETAIL"",""vendorItemReturnNotice"":{""returnCharge"":""5,000원<br/>- 단, 고객 변심의 경우에만 발생<br/>- 부분반품 시, 남은금액이 무료배송 조건을 유지하면 일부 반품비용이 부과""},""vendorItemDeliveryNotice"":{""supportSameDayFresh"":true,""rocketInstall"":false,""rocketFresh"":false,""deliveryMethod"":""순차배송"",""deliveryCompany"":"""",""deliveryCharge"":""무료배송<br/>- 로켓배송 상품 중 19,800원 이상 구매 시 무료배송<br/>- 도서산간 지역 추가비용 없음"",""batchShipment"":""가능"",""shippingPeriod"":null},""sellerDetailInfo"":{""vendorName"":null,""threePM"":false,""threePC"":false,""sellerWithRepPersonName"":null,""retail"":true,""repPhoneNum"":null,""repPersonName"":null,""repEmail"":null,""repAddress2"":null,""repAddress1"":null,""repAddress"":null,""ecommReportNum"":null,""bizNum"":null}},""productSellingPoints"":[],""exemption"":null,""essentials"":[{""title"":""용량(중량)"",""description"":""150 ml""},{""title"":""제품 주요 사양"",""description"":""모든 피부용""},{""title"":""사용기한 또는 개봉 후 사용기간"",""description"":""본 상품은 해당 물류센터 직발송 상품인 관계로 제조연월일 및 유통기한 정보가 매번 변경되어 정확한 정보제공이 어렵습니다.\\t\\t\\t\\t""},{""title"":""사용방법"",""description"":""컨텐츠 참조""},{""title"":""화장품제조업자 및 화장품책임판매업자"",""description"":"" 제품내별도표기/(주)시드물""},{""title"":""']",컨텐츠 참조,해당 없음,"1. 화장품을 사용하여 다음과 같은 이상이 있는 경우에는 사용을 중지하여야 하며, 계속 사용하면 증상이 악화되므로 피부과 전문의 등에게 상담할 것. 가. 사용중 붉은 반점, 부어오름, 가려움증, 자극등의 이상이 있는 경우. 나. 적용부위가 직사광선에 의하여 위와 같은 이상이 있는 경우. 2. 상처가 있는 부위, 습진 및 피부염등의 이상이 있는 부위에는 사용을 하지말 것. 3. 보관 및 취급시의 주의사항 가. 사용후에는 반드시 마개를 닫아둘 것. 나. 유아·소아의 손이 닿지 않는 곳에 보관할 것. 다. 고온 또는 저온의 장소 및 직사광선이 닿는 곳에는 보관하지 말 것.						",제품 이상 시 공정거래위원회 고시 소비자분쟁해결기준에 의거 보상합니다.		,쿠팡 고객센터 1577-7011		,,,,,,,,,https://www.coupang.com/vp/products/4880518173?itemId=6353762537&vendorItemId=5305368894&sourceType=CATEGORY&categoryId=486148,2021-12-29 16:50:34
4334787872,5066069041,79468650871,KAHI 가히 멀티밤 GS단독 특별 기본세트 (멀티밤2개+미스트1개),https://thumbnail10.coupangcdn.com/thumbnails/remote/230x230ex/image/vendor_inventory/de6b/0d383666ad7ad8ae4d7c829a3b1459f7b7532c5fb3b77ee680ee25423a2d.jpg,"60,000",%,원,,"2,587개 상품평",,,상품 상세페이지 참조,상품 상세페이지 참조,상품 상세페이지 참조,상품 상세페이지 참조,상품 상세페이지 참조,상품 상세페이지 참조,"['{""rollbackInterstellar"":false,""productId"":4334787872,""itemId"":5066069041,""vendorItemId"":79468650871,""vendorItemCertifications"":[],""returnPolicyVo"":{""vendorItemReturnPolicyLayoutType"":""THIRD_PARTY"",""vendorItemReturnNotice"":{""returnCharge"":""8,000원<br/>- 단, 고객 변심의 경우에만 발생<br/>- 도서산간 및 일부 지역 추가비용 발생<br/>""},""vendorItemDeliveryNotice"":{""supportSameDayFresh"":true,""rocketInstall"":false,""rocketFresh"":false,""deliveryMethod"":""순차배송"",""deliveryCompany"":""CJ 대한통운"",""deliveryCharge"":""무료배송<br/>· 도서산간 추가 배송비<br/>- 제주 지역: 5,000원<br/>- 도서산간 지역: 5,000원"",""batchShipment"":""불가능"",""shippingPeriod"":null},""sellerDetailInfo"":{""vendorName"":""주식회사 디카라이프"",""threePM"":true,""threePC"":false,""sellerWithRepPersonName"":""주식회사 디카라이프 / 이승현"",""retail"":false,""repPhoneNum"":""010-3394-6283"",""repPersonName"":""이승현"",""repEmail"":""dicalife2377@naver.com"",""repAddress2"":""(공덕동) 나경빌딩 5층"",""repAddress1"":""서울특별시 마포구 만리재로 83"",""repAddress"":""서울특별시 마포구 만리재로 83 (공덕동) 나경빌딩 5층"",""ecommReportNum"":""제 2017-서울마포-2210 호"",""bizNum"":""388-86-00127""}},""productSellingPoints"":[],""exemption"":null,""essentials"":[{""title"":""용량(중량)"",""description"":""상품 상세페이지 참조""},{""title"":""제품 주요 사양"",""description"":""상품 상세페이지 참조""},{""title"":""사용기한 또는 개봉 후 사용기간"",""description"":""상품 상세페이지 참조""},{""title"":""사용방법"",""description"":""상품 상세페이지 참조""},{""title"":""화장품제조업자 및 화장품책임판매업자"",""description"":""상품 상세페이지 참조""},{""title"":""']",상품 상세페이지 참조,상품 상세페이지 참조,상품 상세페이지 참조,상품 상세페이지 참조,상품 상세페이지 참조,주식회사 디카라이프,388-86-00127,제 2017-서울마포-2210 호,서울특별시 마포구 만리재로 83 (공덕동) 나경빌딩 5층,dicalife2377@naver.com,이승현,010-3394-6283,주식회사 디카라이프 / 이승현,https://www.coupang.com/vp/products/4334787872?itemId=5066069041&vendorItemId=79468650871&sourceType=CATEGORY&categoryId=486148,2021-12-29 16:50:34
4821933423,6212935454,4325880090,더모테라피 시카산 리페어레이션 에센스 토너,https://thumbnail7.coupangcdn.com/thumbnails/remote/230x230ex/image/retail/images/694671414109009-ee22e68e-e76b-48f7-9ce9-aef8f0664791.jpg,"7,900",66%,"19,900원",쿠팡판매가,"8,205개 상품평",,,1000ml,모든 피부용,본 상품은 물류센터 직발송 상품인 관계로 제조년월일 및 사용기한 정보가 매번 변경되어 정확한 정보제공이 어렵습니다./제조일로부터 30개월,세안 후 화장솜에 충분히 적셔 얼굴을 닦아줍니다,드림드림인터내셔널,주식회사 트루퍼스아시아,"['{""rollbackInterstellar"":false,""productId"":4821933423,""itemId"":6212935454,""vendorItemId"":4325880090,""vendorItemCertifications"":[],""returnPolicyVo"":{""vendorItemReturnPolicyLayoutType"":""RETAIL"",""vendorItemReturnNotice"":{""returnCharge"":""5,000원<br/>- 단, 고객 변심의 경우에만 발생<br/>- 부분반품 시, 남은금액이 무료배송 조건을 유지하면 일부 반품비용이 부과""},""vendorItemDeliveryNotice"":{""supportSameDayFresh"":true,""rocketInstall"":false,""rocketFresh"":false,""deliveryMethod"":""순차배송"",""deliveryCompany"":"""",""deliveryCharge"":""무료배송<br/>- 로켓배송 상품 중 19,800원 이상 구매 시 무료배송<br/>- 도서산간 지역 추가비용 없음"",""batchShipment"":""가능"",""shippingPeriod"":null},""sellerDetailInfo"":{""vendorName"":null,""threePM"":false,""threePC"":false,""sellerWithRepPersonName"":null,""retail"":true,""repPhoneNum"":null,""repPersonName"":null,""repEmail"":null,""repAddress2"":null,""repAddress1"":null,""repAddress"":null,""ecommReportNum"":null,""bizNum"":null}},""productSellingPoints"":[],""exemption"":null,""essentials"":[{""title"":""용량(중량)"",""description"":""1000ml""},{""title"":""제품 주요 사양"",""description"":""모든 피부용""},{""title"":""사용기한 또는 개봉 후 사용기간"",""description"":""본 상품은 물류센터 직발송 상품인 관계로 제조년월일 및 사용기한 정보가 매번 변경되어 정확한 정보제공이 어렵습니다./제조일로부터 30개월""},{""title"":""사용방법"",""description"":""세안 후 화장솜에 충분히 적셔 얼굴을 닦아줍니다""},{""title"":""화장품제조업자 및 화장품책임판매업자"",""description"":""드림드림인터내셔널/ 주식회사 트루퍼스아시아""},{""title"":""']",컨텐츠참조,해당없음,"1. 화장품을 사용하여 다음과 같은 이상이 있는 경우에는 사용을 중지하여야 하며, 계속 사용하면 증상이 악화되므로 피부과 전문의 등에게 상담할 것. 가. 사용중 붉은 반점, 부어오름, 가려움증, 자극등의 이상이 있는 경우. 나. 적용부위가 직사광선에 의하여 위와 같은 이상이 있는 경우. 2. 상처가 있는 부위, 습진 및 피부염등의 이상이 있는 부위에는 사용을 하지말 것. 3. 보관 및 취급시의 주의사항 가. 사용후에는 반드시 마개를 닫아둘 것. 나. 유아·소아의 손이 닿지 않는 곳에 보관할 것. 다. 고온 또는 저온의 장소 및 직사광선이 닿는 곳에는 보관하지 말 것.						",제품 이상 시 공정거래위원회 고시 소비자분쟁해결기준에 의거 보상합니다.		,쿠팡 고객센터 1577-7011		,,,,,,,,,https://www.coupang.com/vp/products/4821933423?itemId=6212935454&vendorItemId=4325880090&sourceType=CATEGORY&categoryId=486148,2021-12-29 16:50:35
